<?xml version="1.0" encoding="UTF-8"?>
<xs:schema xmlns:xs="http://www.w3.org/2001/XMLSchema" elementFormDefault="qualified">
  <xs:element name="temporada"/>
  
    <xs:complexType name="temporada">
      <xs:sequence>
        <xs:element name="split" type="Tiposplit" minOccurs="0" maxOccurs="unbounded"/>
      </xs:sequence>
    </xs:complexType>
    
    <xs:complexType name="Tiposplit">
      <xs:sequence>
        <xs:element name="jornada" type="Tipojornada" minOccurs="0" maxOccurs="unbounded"/>
        <xs:element name="hora_inicio" type="xs:string"/>
        <xs:element name="hora_fin" type="xs:string"/>
      </xs:sequence>
    </xs:complexType>
    
    <xs:complexType name="Tipojornada">
      <xs:sequence>
        <xs:element name="partido" type="Tipopartido" minOccurs="0" maxOccurs="unbounded"/>
        <xs:element name="fecha" type="xs:string"/>
      </xs:sequence>
    </xs:complexType>    
      
    <xs:complexType name="Tipopartido">
      <xs:sequence>
        <xs:element name="equipo" type="Tipoequipo" minOccurs="0" maxOccurs="unbounded"/>
        <xs:element name="hora" type="xs:string"/>
      </xs:sequence>
    </xs:complexType>
    
    
        <xs:complexType name="Tipoequipo">
      <xs:sequence>
        <xs:element name="nombre" type="xs:string"/>
        <xs:element name="logo" type="xs:string"/>
      </xs:sequence>
    </xs:complexType>
    
    
</xs:schema>